{
  "schema": "ghi.transcript/1",
  "audio": "t01.wav",
  "duration_s": 30.0,
  "pass": "final",
  "lang": "auto",
  "engine": {
    "name": "fixture",
    "version": "1"
  },
  "segments": [
    {
      "id": 0,
      "start": 0,
      "end": 4,
      "text": "Mình chốt scope cho beta nhé.",
      "lang": "vi",
      "speaker": null,
      "words": null
    },
    {
      "id": 1,
      "start": 10,
      "end": 16,
      "text": "Ok Linh sẽ gửi tài liệu scope hôm nay",
      "lang": "vi",
      "speaker": null,
      "words": null
    },
    {
      "id": 2,
      "start": 22,
      "end": 28,
      "text": "Còn lịch họp tuần sau thì sao",
      "lang": "vi",
      "speaker": null,
      "words": null
    }
  ],
  "perf": {
    "wall_s": 1.0,
    "rtf": 0.05,
    "peak_rss_mb": null
  }
}
