{
 "schema": "ghi.transcript/1",
 "audio": "en.wav",
 "duration_s": 112.65,
 "pass": "final",
 "lang": "en",
 "engine": {
  "name": "synthetic",
  "version": "1"
 },
 "segments": [
  {
   "id": 0,
   "start": 0.0,
   "end": 4.05,
   "text": "Morning everyone, let's go through the beta launch plan.",
   "lang": "en",
   "speaker": "S1",
   "words": null
  },
  {
   "id": 1,
   "start": 4.65,
   "end": 9.6,
   "text": "Sure. The build is ready except for the calendar sync feature.",
   "lang": "en",
   "speaker": "S2",
   "words": null
  },
  {
   "id": 2,
   "start": 10.2,
   "end": 17.85,
   "text": "I think we should ship the beta without calendar sync and add it in the next release.",
   "lang": "en",
   "speaker": "S1",
   "words": null
  },
  {
   "id": 3,
   "start": 18.45,
   "end": 24.3,
   "text": "Agreed, calendar sync is not stable yet. We saw two crashes last week.",
   "lang": "en",
   "speaker": "S3",
   "words": null
  },
  {
   "id": 4,
   "start": 24.9,
   "end": 28.5,
   "text": "Okay, decided: the beta ships without calendar sync.",
   "lang": "en",
   "speaker": "S1",
   "words": null
  },
  {
   "id": 5,
   "start": 29.1,
   "end": 34.05,
   "text": "Then I need the final release notes. Who can write them?",
   "lang": "en",
   "speaker": "S2",
   "words": null
  },
  {
   "id": 6,
   "start": 34.65,
   "end": 40.05,
   "text": "I'll write the release notes and send them to everyone by Thursday.",
   "lang": "en",
   "speaker": "S3",
   "words": null
  },
  {
   "id": 7,
   "start": 40.65,
   "end": 44.7,
   "text": "Great. Next topic is pricing for the paid plan.",
   "lang": "en",
   "speaker": "S1",
   "words": null
  },
  {
   "id": 8,
   "start": 45.3,
   "end": 49.8,
   "text": "Marketing suggested nine dollars per month, but finance hasn't confirmed.",
   "lang": "en",
   "speaker": "S2",
   "words": null
  },
  {
   "id": 9,
   "start": 50.4,
   "end": 55.35,
   "text": "Let's not decide pricing today. We need numbers from finance first.",
   "lang": "en",
   "speaker": "S1",
   "words": null
  },
  {
   "id": 10,
   "start": 55.95,
   "end": 59.55,
   "text": "Should we offer a discount for early users?",
   "lang": "en",
   "speaker": "S3",
   "words": null
  },
  {
   "id": 11,
   "start": 60.15,
   "end": 64.2,
   "text": "Good question, nobody knows yet. Let's keep it open.",
   "lang": "en",
   "speaker": "S1",
   "words": null
  },
  {
   "id": 12,
   "start": 64.8,
   "end": 68.85,
   "text": "I'll ask finance for the cost numbers before Monday.",
   "lang": "en",
   "speaker": "S2",
   "words": null
  },
  {
   "id": 13,
   "start": 69.45,
   "end": 74.4,
   "text": "Also, the support inbox is growing. We have forty unanswered tickets.",
   "lang": "en",
   "speaker": "S1",
   "words": null
  },
  {
   "id": 14,
   "start": 75.0,
   "end": 79.05,
   "text": "I can spend Friday afternoon clearing the support queue.",
   "lang": "en",
   "speaker": "S3",
   "words": null
  },
  {
   "id": 15,
   "start": 79.65,
   "end": 84.6,
   "text": "Thanks. And please remember the security review is on the fifteenth.",
   "lang": "en",
   "speaker": "S1",
   "words": null
  },
  {
   "id": 16,
   "start": 85.2,
   "end": 89.25,
   "text": "Right, the auditors want the encryption design document first.",
   "lang": "en",
   "speaker": "S2",
   "words": null
  },
  {
   "id": 17,
   "start": 89.85,
   "end": 94.35,
   "text": "I'll send the encryption design document to the auditors tomorrow.",
   "lang": "en",
   "speaker": "S1",
   "words": null
  },
  {
   "id": 18,
   "start": 94.95,
   "end": 100.35,
   "text": "One more thing: the onboarding video is too long, users skip it.",
   "lang": "en",
   "speaker": "S3",
   "words": null
  },
  {
   "id": 19,
   "start": 100.95,
   "end": 105.0,
   "text": "Let's cut the onboarding video to under two minutes.",
   "lang": "en",
   "speaker": "S1",
   "words": null
  },
  {
   "id": 20,
   "start": 105.6,
   "end": 108.3,
   "text": "I'll edit the video next week.",
   "lang": "en",
   "speaker": "S2",
   "words": null
  },
  {
   "id": 21,
   "start": 108.9,
   "end": 112.05,
   "text": "Perfect. That's all for today, thanks everyone.",
   "lang": "en",
   "speaker": "S1",
   "words": null
  }
 ],
 "perf": {
  "wall_s": 0.0,
  "rtf": null,
  "peak_rss_mb": null
 }
}
